{
  "mappings": [
    {
      "closure_status": "evidence-incomplete",
      "goal_fingerprint": "sha256:c1f3136ae4b4a95be8b04fe923e3ccd023334843f40b9d42589cc05983d6370a",
      "graph_cache_fingerprint": "sha256:faa088155581da2f0e862159e126a6701b57c210debf53f43ee6364eba0a8ab3",
      "mapping_fingerprint": "sha256:812b5d98cbc3d8032d57bbb9f0168991c44c61391ccbaf09bf5e7e1e1adefab2",
      "path_hashes": {
        "scripts/code-graph-mapper.py": "sha256:7e14d2958ae2601f7accc346a5871fa83d149cfcc0e3c7f401e26539e42c6f08",
        "scripts/code_graph_cache.py": "sha256:00ebf2a49297dca1f1e2f9b264a8b13f208ebdc86f4bdf9bbbf8c8ead6ad7088"
      },
      "query_terms": [
        "and",
        "changing",
        "code-graph-mapper",
        "code_graph_cache",
        "discovery",
        "fail-closed",
        "implement",
        "shape-mismatch",
        "stage"
      ],
      "recorded_at": "2026-09-24T10:56:46.828391+00:00",
      "run_id": "start-20260924104250-1c33c2",
      "scope_decision_fingerprint": "sha256:c1c6d06a54db7204b77c7282b1f31c7258e51756fe117a151c4774be02683530"
    },
    {
      "closure_status": "evidence-incomplete",
      "goal_fingerprint": "sha256:ec8e7339f321dc399fa9664240173b3bad1943f1efce20be2bcdf90ffc9508f8",
      "graph_cache_fingerprint": "sha256:a6981b3054a27ef68cc3aaba973e53f06c61cc6aa09b1ab60c7b0679bfa7da4e",
      "mapping_fingerprint": "sha256:8e0bff2989a0ae752fffb850bf08d9a57b5aa7a8a6a98470c6bdb60b36bbca0e",
      "path_hashes": {
        "scripts/architecture_planning.py": "sha256:48c1d8d5d3365e99ff48810424593001ae965956f1bd0ac331537c234f68f74b",
        "scripts/navigator-scope-release.py": "sha256:099a0454587806395f28f644b3a69849d99eef5d805bd897309b0a07803b43c9",
        "scripts/navigator-scope.py": "sha256:19eda1b7d57181c2632e86941e511c07489f3a6bced9bbc3a83e4dc7a84a96ff",
        "scripts/navigator_discovery.py": "sha256:5747029a4c7befd3bc667d45b7849bc16114ab328e29f55639fc6b65ce633972",
        "scripts/navigator_scope.py": "sha256:bc25a768035e26541d3d775b3f45376ff047073a6e6dcdf4c23b1f64b2cc8251",
        "scripts/test_scope.py": "sha256:de1f275f3f6924303454c5ddd518cd081b4d84b9021fe2bb68e491948ea1f9c3",
        "tests/test_navigator_scope.py": "sha256:57b0a531558c16c5d3b0c9e0e4eb254971e4f9965fae77c1c98bfc490adf61e3",
        "tests/test_navigator_scope_release.py": "sha256:a70180b38519ba648a51fe3bc375870a4f12b6a5132bbe8dd358b209150f33a6",
        "tests/test_scope_capture_wiring.py": "sha256:df6f22f2b5822c26461b5127570229967bfa2ab7448f5e9e2228e3511ffa3587"
      },
      "query_terms": [
        "add",
        "anchor",
        "and",
        "branch",
        "changes",
        "convention",
        "current",
        "discovery",
        "host-proposed-new-path",
        "implement",
        "integration",
        "labeled",
        "linked",
        "navigator_scope",
        "only",
        "path",
        "project-relative",
        "proposal",
        "proposed_new_path",
        "requirement",
        "safe",
        "scope",
        "stage",
        "validate_host_proposal",
        "validation"
      ],
      "recorded_at": "2026-09-24T15:34:33.047809+00:00",
      "run_id": "start-20260924144039-0afe39",
      "scope_decision_fingerprint": "sha256:4661e70524de2a342aedb46cb64defcf67a11d60b8c737aca9fa1bf51ab071b9"
    },
    {
      "closure_status": "evidence-incomplete",
      "goal_fingerprint": "sha256:b7b1b5530fa88f28764cf2cfe410f0a77216a1b74eca37fa4a142ae2987fc782",
      "graph_cache_fingerprint": "sha256:7a7856d594b2454b8104f8dac20f88d617768a42522bc2ecf3b7d238713e27d2",
      "mapping_fingerprint": "sha256:78ce14314ff03323a4682a297dcca06e8d93d1e1dad5f85c5a59f12bcaf267df",
      "path_hashes": {
        "scripts/code-graph-mapper.py": "sha256:9b9d333614f17154b36c31e0fdc79363d950e13ea5e75fcc9eafdeb381e30f6f",
        "scripts/graph_builder.py": "sha256:f6a968d60fb356e25a7c6ee35cf30ba66126abf1b0648fdc9f2ec086d231ad85",
        "scripts/navigator_graph_lifecycle.py": "sha256:d4212faca1b031544b40dab24ccb95b68358ec9ac425cf4e95747bad4b2e7e13",
        "tests/test_navigator_core.py": "sha256:ae8e490f694b80c44feee528ccbb6be4660b9fb99a33b01a55f8f76b476647bc"
      },
      "query_terms": [
        "anchor",
        "and",
        "changes",
        "code-graph-mapper",
        "container",
        "contract",
        "coverage",
        "discovery",
        "facts",
        "files",
        "graph",
        "hash",
        "implement",
        "missing",
        "only",
        "packet",
        "per-file",
        "queryable",
        "read",
        "relation",
        "reparse",
        "reparsing",
        "sections",
        "shape",
        "shared",
        "slice",
        "stage",
        "stale",
        "the",
        "write"
      ],
      "recorded_at": "2026-09-24T16:21:11.379127+00:00",
      "run_id": "start-20260924160123-0b07b9",
      "scope_decision_fingerprint": "sha256:fad50801fa31ea9cd58161de4fefccb019f3096fa098fa7b533d721a481323b2"
    },
    {
      "closure_status": "evidence-incomplete",
      "goal_fingerprint": "sha256:06689966f46cd6b6f9e9264e34080f79bf17cb55c25b40d81a7266e6299c054b",
      "graph_cache_fingerprint": "sha256:918489d61b44757186653ea3210e3b18ba802a68b37c5f2d44c0091cb95dc9e0",
      "mapping_fingerprint": "sha256:b198ce961f0e432b5c01cb55299364d13c46a0e8f1d0a16aa1e3e6d13b661cfb",
      "path_hashes": {
        "scripts/architecture_planning.py": "sha256:48c1d8d5d3365e99ff48810424593001ae965956f1bd0ac331537c234f68f74b",
        "scripts/navigator_graph_lifecycle.py": "sha256:385b06ca9da4bd38f2afa00092bc63eebe900243c0c31c0072deb76e1e1e6bf8",
        "scripts/navigator_scope.py": "sha256:df1066457cd23d8a00ccc1d0f762e2b8bdef9a0d75d1d5a10890bc02522eb42a",
        "tests/test_navigator_graph_lifecycle.py": "sha256:0ca3c6c9af9736438b9113b6006be3f1b4adcdb5b6e9be01ffd84844ca33896b",
        "tests/test_navigator_scope.py": "sha256:62dde20e7a97e9d352cb7aee5c7fb38baec04c5dff0ec9aba4be752fba015ed1",
        "tests/test_navigator_scope_release.py": "sha256:a70180b38519ba648a51fe3bc375870a4f12b6a5132bbe8dd358b209150f33a6"
      },
      "query_terms": [
        "across",
        "and",
        "api",
        "candidate",
        "cases",
        "cli",
        "conformance",
        "every",
        "exactly",
        "extension",
        "fixtures",
        "focused",
        "fresh-but-unrelated",
        "implement",
        "infrastructure",
        "layouts",
        "legacy-shape",
        "mapping",
        "nomination",
        "one",
        "onto",
        "outside-slice",
        "partial-slice",
        "plus",
        "projection",
        "read",
        "recording",
        "rejection",
        "role",
        "role-mapping",
        "stage",
        "table",
        "test",
        "tests",
        "topology",
        "worker"
      ],
      "recorded_at": "2026-09-25T02:46:46.328647+00:00",
      "run_id": "start-20260925021504-cee705",
      "scope_decision_fingerprint": "sha256:719c0de2bbcc14051e3adc9d8beeee4d47dc44dcfb30e6ee5dd01a0f5344bb0f"
    },
    {
      "closure_status": "evidence-incomplete",
      "goal_fingerprint": "sha256:144e887773d141e6a1ab3e978e1e96fe157998e6d983bdf0024549d9a29fdb08",
      "graph_cache_fingerprint": "sha256:8fb9b9394801492a4b2b6f255e91a3339847f3472c2ed5b98dbabd039899152a",
      "mapping_fingerprint": "sha256:88a521283f5a74c4ae4a4a95174d5f7977335147ea90c7382e9003e7168aaf5d",
      "path_hashes": {
        "navigator.legacy.py": "sha256:d1399783b471e9970367a739bb44840f5edaee72ff4cb2c6c090b91cff8f8977",
        "pyproject.toml": "sha256:e93422a4f4c7540efd68239ab4feaa4317211d11f8db40734bc1c00df3b83cde",
        "scripts/adoption-validation.py": "sha256:3e0d7f1c0f3b85a118db99b2bbf494449691a25ce23f3dbdf49f87abc4c0ad03",
        "scripts/advanced-runtime.py": "sha256:6ed0374e22435ad7174fc68bd95700f0d3d317cccf85f0134e78d59b7d408851",
        "scripts/aidlc-check.py": "sha256:56fd1a35ca3873267191e1e95c9c26e07b5c9320dacc330e7d7df018751685c5",
        "scripts/aidlc-official-bridge.py": "sha256:490f6986fcc7264aae39b78270b4f4217873f9d9ace701ae2468d3136957a5a3",
        "scripts/aidlc-official-detect.py": "sha256:ef7c06e294f4ad6826cedadc0a9326952a2a15c7420b9d8f17f613543de8fed1",
        "scripts/aidlc-official-host.py": "sha256:6aad994c6818e4fec42992ff4bfeea1287ed843de3df5ecc0f65930f06b4f7d5",
        "scripts/aidlc-official-install.py": "sha256:d5405d0955b52e96be0abe3eb6c4ab6af5ffc6e305973b4bfda67894f3a2a6a3",
        "scripts/code-graph-mapper.py": "sha256:9b9d333614f17154b36c31e0fdc79363d950e13ea5e75fcc9eafdeb381e30f6f",
        "scripts/code_graph_inventory.py": "sha256:e434a3cbca4664b9fb4a1f5dc53c27e1ea3be0ef60d9fa7de33552dcc6d00f5f",
        "scripts/learning-refresh.py": "sha256:d2feddc37ed54564f47f29a8e67ff57ded292551b9e186ad64c0a7f4ac8e3e27",
        "scripts/navigator_graph_lifecycle.py": "sha256:385b06ca9da4bd38f2afa00092bc63eebe900243c0c31c0072deb76e1e1e6bf8",
        "scripts/planning-investigation.py": "sha256:1e5450386bf242885ad96fdeaa86fb1dd43bbd7622194111c5a42d59bffb6636",
        "scripts/prompt-profile.py": "sha256:a012ff4cf1fc2b27ba758991be55362e1d9357b87a770311e43e039d55d4ab09",
        "scripts/prompt_profile.py": "sha256:750757d5ae0de562c81cf088c93d3ecaa86326d9e79c78b4e63bde7ffa0b2f50",
        "scripts/testing-profile.py": "sha256:8e75f04b97689f5aaa023f2c8066b4aa1d239a04576c9e15e2aeb85fec3a23dc",
        "tests/test_learning_refresh_sweep.py": "sha256:b557ef5613225e28dc5b63f6aac666296833b60907495c5ce239968b5052eb93",
        "tests/test_navigator_graph_lifecycle.py": "sha256:71f05acf5f46c2d856461688056fe0c8956bd1957139fb716c34b023120239ad",
        "tests/test_planning_investigation.py": "sha256:6806a98769c05eb3272714756698c00f4a6400bae4b7c64cf88293430d4a032d",
        "tests/test_testing_profile.py": "sha256:3121b2f50f3dfd79cbedf006b4525bfcab5f33b5cfe8701e4bc3a723bc0f6bd4"
      },
      "query_terms": [
        "anchor",
        "and",
        "authority",
        "changes",